cedula;nombre;correoucab;correoparticular;telefono;comentario
1233123;joles jose;qtorres@hispavista.com;silvia64@rodriquez.com.ve;0424956254;Quod odit iusto eligendi illum ut aut.
1739225;Lcda. Ona Nieves;oordonez@pereira.co.ve;pozo.victoria@yahoo.com;04245161;Consequatur impedit natus aut adipisci qui iste velit.
68236239;Lcdo. Santiago Hidalgo;westeban@medrano.com;naiara40@hotmail.com;15652312;Quae amet corrupti dolorem inventore voluptatem.
1091758;Juan Robledo;montenegro.laura@velasco.web.ve;africa.irizarry@cantu.org;151215;Harum officiis dicta iste earum non eum id.
725154;Dra. Maria Aparicio Hijo;zcastellano@leon.org.ve;cardenas.abril@latinmail.com;1515105;Illum voluptates officia reiciendis tempore.
243915;Roberto Juan Contreras;adriana09@latinmail.com;prado.ainara@terra.com;1552562;Iure voluptas maxime aliquam iure et corporis.
69022267;Isaac Victor Santiago;bvillasenor@hotmail.es;cintron.jose@gmail.com;+58 4399408435;Quae maxime praesentium tenetur rerum.
1125197;Noelia Carrasquillo;fvilla@cantu.co.ve;pozo.yaiza@coronado.net;+58 434-2798839;Non quia sequi molestiae debitis dolorem sunt.
15424130;Lola Bella Andrés;uordonez@hinojosa.co.ve;francisco.tirado@hispavista.com;+58 4858496724;Et corrupti praesentium rerum ducimus consequatur.
21848222;Dn. Ignacio Abreu;omar63@yahoo.com;leyre.hurtado@carrion.web.ve;+58 205 5056973;Voluptatem distinctio placeat corporis rerum in necessitatibus.
31238232;Africa Acevedo Rincón;cepeda.claudia@latinmail.com;ismael19@hotmail.com;230-089-7680;Qui ducimus adipisci quaerat molestiae.
683212;Laura Naia Atencio;ocastellano@yahoo.es;dfajardo@hotmail.es;+58 247-326-6412;Ut occaecati accusantium nihil rerum aut.
501956235;Dn. Adam Ferrer Hijo;ecazares@trevino.com.ve;kocampo@live.com;432 5667340;Corrupti molestiae nostrum ex possimus suscipit sapiente.
110513103;Dn. Sebastian Polo;breynoso@magana.org;izan86@olivarez.org;250-412-8327;Culpa error eos quaerat odio.
126327184;Nayara Estévez Villalpando;ucarrasco@yahoo.es;eric.carrion@razo.info.ve;+58 298-4360230;Illum voluptas voluptas adipisci sunt rerum assumenda qui pariatur.
88320200;Ing. David Chávez Hijo;marco86@montoya.co.ve;olivo.beatriz@live.com;+58 429-5284273;Rerum nemo quia laboriosam blanditiis.
108237754;Rayan Leo Corona Quintana;hector35@sola.net.ve;alejandro97@live.com;+58 2523329327;Pariatur voluptatibus repellendus incidunt ipsam rerum.
29043152;Lcdo. Eric Clemente Hijo;gaytan.ismael@conde.co.ve;melizondo@arredondo.net.ve;472 5014662;Odio necessitatibus sunt esse esse fuga ut magni.
25219248;Adria Miramontes Hijo;alma.brito@anton.co.ve;marco.pedro@pantoja.co.ve;+58 483 4875747;Aut ut a sed reprehenderit.
11959882;Lcda. Abril Olmos Hijo;dvargas@sevilla.org;ltrejo@mojica.co.ve;452 326 1568;Reprehenderit quasi consequatur rem eum et cumque.
6199223;Raul Marco Urbina;cristian.sancho@yahoo.es;peralta.joan@terra.com;+58 2511922840;Numquam adipisci quisquam illum repellat delectus enim dicta.
384853;Erik Adam Valero;cabello.julia@vera.org.ve;cristian.terrazas@hispavista.com;496 1007891;Et pariatur at nemo nam.
155218532;Pol Nicolas Riojas Arribas;alejandra11@yahoo.com;jimena.tapia@vaca.net;2316558390;At sunt iusto est beatae.
18915134;Guillermo Almaraz Hijo;saul65@hotmail.es;elsa.pacheco@ordonez.co.ve;496-6263330;Autem eligendi ea illo ut et porro.
77210255;Lola Victoria Giménez;carla.paz@live.com;upedroza@resendez.org;+58 256-7120866;Placeat quae quo vero iste est optio in autem.
